{
  "$schema": "https://json-schema.org/draft/2020-12/schema",
  "$id": "https://contracts.loan-platform.example/schemas/events/unfavorable-credit-decision-recorded.v1.schema.json",
  "title": "UnfavorableCreditDecisionRecorded.v1",
  "type": "object",
  "additionalProperties": false,
  "properties": {
    "eventId": {
      "type": "string",
      "minLength": 1
    },
    "eventType": {
      "type": "string",
      "minLength": 1
    },
    "eventVersion": {
      "type": "integer",
      "minimum": 0
    },
    "occurredAt": {
      "type": "string",
      "format": "date-time",
      "pattern": "Z$"
    },
    "aggregateId": {
      "type": "string",
      "minLength": 1
    },
    "correlationId": {
      "type": "string",
      "minLength": 1
    },
    "causationId": {
      "type": "string",
      "minLength": 1
    },
    "producer": {
      "type": "string",
      "minLength": 1
    },
    "traceId": {
      "type": "string",
      "minLength": 1
    },
    "payload": {
      "type": "object",
      "additionalProperties": false,
      "properties": {
        "assessmentId": {
          "type": "string",
          "minLength": 1
        },
        "applicationId": {
          "type": "string",
          "minLength": 1
        },
        "decisionId": {
          "type": "string",
          "minLength": 1
        },
        "reasonCodes": {
          "type": "array",
          "minItems": 1,
          "uniqueItems": true,
          "items": {
            "type": "string",
            "minLength": 1
          }
        },
        "policyVersion": {
          "type": "string",
          "minLength": 1
        },
        "rulesetVersion": {
          "type": "string",
          "minLength": 1
        }
      },
      "required": [
        "assessmentId",
        "applicationId",
        "decisionId",
        "reasonCodes",
        "policyVersion",
        "rulesetVersion"
      ]
    }
  },
  "required": [
    "eventId",
    "eventType",
    "eventVersion",
    "occurredAt",
    "aggregateId",
    "correlationId",
    "causationId",
    "producer",
    "traceId",
    "payload"
  ]
}
